<?xml version='1.0' encoding='UTF-8' ?>

<!DOCTYPE config PUBLIC "-//HawkinsSoftware//DTD config 1.0//EN" "http://somewhere/dtd/config.dtd">

<EditorConfig>
	<Setup>
		<InstallRoot>c:\dev\decaf_demo</InstallRoot>
		<BrowserCommand></BrowserCommand>
		<PluginsPackage>com.bitwise.umail</PluginsPackage>
		<CompileCommand>c:\dev\decaf_demo\bin\jikes</CompileCommand>
	</Setup>
	<ClassComponents>
		<NameComponent>
			<classname>com.bitwise.decaf.editor.DTextField</classname>
			<FormLocation>
				<row>0</row>
				<column>0</column>
			</FormLocation>
		</NameComponent>
		<CustomComponent>
			<classname>com.bitwise.decaf.editor.Fields</classname>
			<FormLocation mode="LABEL_ON_TOP">
				<row>10</row>
				<column>0</column>
			</FormLocation>
		</CustomComponent>
		<CustomComponent>
			<classname>com.bitwise.decaf.editor.MethodsBox</classname>
			<FormLocation mode="LABEL_ON_TOP">
				<row>20</row>
				<column>0</column>
			</FormLocation>
		</CustomComponent>
	</ClassComponents>
	<MethodComponents>
		<NameComponent>
			<classname>com.bitwise.decaf.editor.DTextField</classname>
			<FormLocation>
				<row>0</row>
				<column>0</column>
			</FormLocation>
		</NameComponent>
		<ReturnComponent>
			<classname>com.bitwise.decaf.editor.DTypeBox</classname>
			<FormLocation>
				<row>10</row>
				<column>0</column>
			</FormLocation>
		</ReturnComponent>
		<CustomComponent>
			<classname>com.bitwise.decaf.editor.Parameters</classname>
			<FormLocation mode="LABEL_ON_TOP">
				<row>20</row>
				<column>0</column>
			</FormLocation>
		</CustomComponent>
	</MethodComponents>
	<ParameterComponents>
		<NameComponent>
			<classname>com.bitwise.decaf.editor.DTextField</classname>
			<FormLocation>
				<row>0</row>
				<column>0</column>
			</FormLocation>
		</NameComponent>
		<TypeComponent>
			<classname>com.bitwise.decaf.editor.DTypeBox</classname>
			<FormLocation>
				<row>10</row>
				<column>0</column>
			</FormLocation>
		</TypeComponent>
	</ParameterComponents>
	<FieldComponents>
		<NameComponent>
			<classname>com.bitwise.decaf.editor.DTextField</classname>
			<FormLocation>
				<row>0</row>
				<column>0</column>
			</FormLocation>
		</NameComponent>
		<TypeComponent>
			<classname>com.bitwise.decaf.editor.DTypeBox</classname>
			<FormLocation>
				<row>10</row>
				<column>0</column>
			</FormLocation>
		</TypeComponent>
	</FieldComponents>
	<LocalComponents>
		<NameComponent>
			<classname>com.bitwise.decaf.editor.DTextField</classname>
			<FormLocation>
				<row>0</row>
				<column>0</column>
			</FormLocation>
		</NameComponent>
		<TypeComponent>
			<classname>com.bitwise.decaf.editor.DTypeBox</classname>
			<FormLocation>
				<row>10</row>
				<column>0</column>
			</FormLocation>
		</TypeComponent>
	</LocalComponents>
	<Grammars>
		<Phrase>com.bitwise.decaf.editor.grammar.If</Phrase>
		<Phrase>com.bitwise.decaf.editor.grammar.Binary</Phrase>
		<Phrase>com.bitwise.decaf.editor.grammar.Comparison</Phrase>
		<Phrase>com.bitwise.decaf.editor.grammar.Access</Phrase>
		<Sentence>com.bitwise.decaf.editor.grammar.LocalVariable</Sentence>
		<Sentence>com.bitwise.decaf.editor.grammar.If</Sentence>
		<Sentence>com.bitwise.decaf.editor.grammar.While</Sentence>
		<Sentence>com.bitwise.decaf.editor.grammar.Binary</Sentence>
		<Sentence>com.bitwise.decaf.editor.grammar.Access</Sentence>
		<Sentence>com.bitwise.decaf.editor.grammar.Report</Sentence>
		<!--<Sentence>com.bitwise.decaf.editor.grammar.Return</Sentence>-->
	</Grammars>
	<TypeChooserContent>
		<TypeCategory name="uMail">
			<TypeItem uid="Account"/>
			<TypeItem uid="User"/>
			<TypeItem uid="DataDisplay"/>
			<TypeItem uid="Folder"/>
			<TypeItem uid="FolderMenuOption"/>
			<TypeItem uid="FolderMenuPlugin"/>
			<TypeItem uid="Menu"/>
			<TypeItem uid="Plugin"/>
			<TypeItem uid="Message"/>
			<TypeItem uid="MessageDisplay"/>
			<TypeItem uid="MessageInput"/>
			<TypeItem uid="MessageMenuOption"/>
			<TypeItem uid="Prompt"/>
		</TypeCategory>
		<TypeCategory name="Basic">		
			<TypeItem uid="Number"/>
			<TypeItem uid="True/False"/>
			<TypeItem uid="Void"/>
		</TypeCategory>
		<TypeCategory name="Foundation">		
			<TypeItem uid="Anything"/>
			<TypeItem uid="Text"/>
			<TypeItem uid="Date"/>
			<TypeItem uid="List"/>
			<TypeItem uid="ListWalk"/>
			<TypeItem uid="ListWalk2"/>
			<TypeItem uid="System"/>
			<TypeItem uid="NumberClass"/>
		</TypeCategory>
	</TypeChooserContent>
	<TypeDefinitions>

		<!-- Expected User Methods -->

		<TypeDefinition Classname="#user" uid="#none">
			<Method name="createMessage">
				<Discussion>
					This method collects information from the user for a new email message.  The server 
					has created the message for you and placed it in messageInput.getMessage().  The 
					messageInput object also contains standard prompts for the toAddress, subject, and 
					message body.  Feel free to customize these before using them to gather user input 
					for the message.  Note: if there is no recipient specified, the server will not 
					deliver the message.
				</Discussion>
				<Parameter type="Account" name="fromAccount">
					This is the sender's email account.
				</Parameter>
				<Parameter type="MessageInput" name="messageInput">
					This is the message input facility.  It contains prompts for each of the 
					message components: to, subject and body.  It also contains the message
					itself, initialized with your email address as the sender.
				</Parameter>
			</Method>
			<Method name="getFolderMenu">
				<Discussion>
					This method assembles the folder menu, listing the messages and sub-folders of the current
					folder, along with any context-related functions you would like to offer the user.  Typically
					the menu needs to contain a "Delete" item.  The server will append an item "Done" that steps
					up to the parent menu of this menu.
				</Discussion>
				<Parameter type="Account" name="currentAccount">
					The account being viewed.
				</Parameter>
				<Parameter type="Folder" name="currentFolder">
					The folder being viewed.
				</Parameter>
				<Parameter type="Menu" name="thisMenu">
					The menu we are constructing for display.
				</Parameter>
			</Method>
			<Method name="getPluginMenu">
				<Discussion>
					This method assembles the plugins menu, which offer the user plugin functions that run without
					any particular context (unlike the folder menu, which operates in the context of a particular
					mail folder).  The menu expects objects of type Plugin.
				</Discussion>
				<Parameter type="Account" name="currentAccount">
					The account being accessed.
				</Parameter>
				<Parameter type="Menu" name="pluginMenu">
					The plugin menu, awaiting your customized selections.
				</Parameter>
			</Method>
			<Method name="exit">
				<Discussion>
					This method is run when the user exits the uMail application.  You might give a "goodbye" message,
					delete items from a "Deleted Items" folder, etc.
				</Discussion>
				<Parameter type="Account" name="currentAccount">
					The account being exited.
				</Parameter>
			</Method>
			<Method name="displayMessage">
				<Discussion>
					This method displays a message to the screen, and is immediately followed by the folder menu.
					The messageDisplay object contains the message, and facilities for displaying it to screen.
				</Discussion>
				<Parameter type="Account" name="currentAccount">
					The account being viewed.
				</Parameter>
				<Parameter type="MessageDisplay" name="messageDisplay">
					This object contains the message in getMessage(), and a DataDisplay facility for each field of
					the message.  Be sure to call init() before displaying any of the message values.  The method 
					align() will properly align the values column.
				</Parameter>
			</Method>
			<Method name="sendMail">
				<Discussion>
					This method is run after the user has created a message, but before it is actually
					sent.  You might want to put a copy in a "Sent Items" folder, or send a copy to the 
					user's alternate account.  The server of course performs the actual task of sending
					the message to its destination.
				</Discussion>
				<Parameter type="Account" name="currentAccount">
					The sender's account.
				</Parameter>
				<Parameter type="Message" name="message">
					The message being sent; it has already been created and contains the appropriate information, 
					though you are free to make changes such as automated keyword replacements.
				</Parameter>
			</Method>
			<Method name="receiveMail">
				<Discussion>
					This method runs when a message is received by an account.  It is responsible for putting 
					the message in the user's inbox, or filing it in some other appropriate folder.  You might
					want to delete messages under certain criteria, or perhaps notify the user in the case of
					a particularly important arrival.
				</Discussion>
				<Parameter type="Account" name="currentAccount">
					The recipient's account.
				</Parameter>
				<Parameter type="Message" name="message">
					The message being received.
				</Parameter>
			</Method>
			
		</TypeDefinition>

		<!-- jType`s -->

		<TypeDefinition Classname="com.bitwise.umail.SWIGTYPE_p_void" uid="SwigVoid"/>
		<TypeDefinition Classname="com.bitwise.umail.jType" uid="MenuOption"/>	
			<!-- for now, MenuOption is the only user application of the generic jType -->

		<TypeDefinition Classname="com.bitwise.umail.jAccount" uid="Account">
			<Discussion>
				An email account.
			</Discussion>
			<Method name="getRoot">
				<Discussion>
					Returns the top folder of the tree of email folders.
				</Discussion>
			</Method>
			<Method name="log">	
				<Discussion>